{
  "protocol_version": 1,
  "control_state_status": "VALID",
  "validated_at": "2026-09-26T16:45:34Z",
  "validation_mode": "LIVE_GITHUB",
  "repository": "krumingo/BEG_Worck",
  "branch": "codex/claude-queue",
  "producer": "CODEX",
  "active_source_commit_sha": "4b2ee790c0de419f6025b394161e0b4ea3a2c602",
  "control_state_commit_sha": "7e9b1889a94247f589c181de1848730e7f0d1cc9",
  "generated_from": [
    "ACTIVE",
    "REVIEW",
    "PR/HANDOFF",
    "CANONICAL_DOCS"
  ],
  "task_id": "W0-03C",
  "cycle_id": "C03",
  "cycle_origin": "NATIVE",
  "current_agent": "GPT",
  "current_role": "ARCHITECT",
  "agent_states": {
    "GPT": {
      "state": "WORKING",
      "work_id": "W0-03C/C03/GPT",
      "waiting_for": null,
      "updated_at": "2026-09-26T16:45:12Z"
    },
    "CODEX": {
      "state": "PASS",
      "work_id": "W0-03C/C03/CX",
      "waiting_for": null,
      "updated_at": "2026-09-26T16:29:12Z"
    },
    "CLAUDE": {
      "state": "HANDOFF",
      "work_id": "W0-03C/C03/CL",
      "waiting_for": null,
      "updated_at": "2026-09-26T15:29:30Z"
    }
  },
  "current_work_id": "W0-03C/C03/GPT",
  "state": "WORKING",
  "pipeline_step": "ARCHITECT_FEEDBACK",
  "next_agent": "GPT",
  "waiting_for": null,
  "wave": "W0",
  "flow": "FLOW-032",
  "pr_number": 20,
  "pr_head_sha": "e3c4ad8cd5b204eb806c39202cc00dd586bc9049",
  "pr_draft": false,
  "dispatch_state": "NONE",
  "dispatch_run_url": "https://claude.ai/epitaxy/session_012DCBdX2BRA6U2UR5zkdkPe",
  "last_handoff": {
    "url": "https://github.com/krumingo/BEG_Worck/pull/20#issuecomment-5847481878",
    "head_sha": "e3c4ad8cd5b204eb806c39202cc00dd586bc9049",
    "at": "2026-09-26T15:29:30Z"
  },
  "last_review": {
    "path": "coordination/REVIEWS/W0-03C.md",
    "blob_sha": "4b87939057c1d573279b07879739691af9dc4da0",
    "reviewed_head_sha": "e3c4ad8cd5b204eb806c39202cc00dd586bc9049",
    "verdict": "PASS"
  },
  "relay": {
    "last_agent": "CODEX",
    "last_event": "PR #20 MERGED",
    "last_result": "PASS",
    "required_by_krum": false,
    "from": "CODEX",
    "to": "GPT",
    "status": "RECEIVED",
    "instruction": "No relay action; ChatGPT is deciding the next W0-03 stage.",
    "source_url": "https://github.com/krumingo/BEG_Worck/issues/26#issuecomment-5847959264",
    "updated_at": "2026-09-26T16:37:03Z"
  },
  "requires_krum": false,
  "requires_krum_reason": null,
  "progress": {
    "mode": "STAGE_ONLY",
    "stage": "MERGED",
    "completed": null,
    "total": null,
    "percent": null
  },
  "source_refs": {
    "active_path": "coordination/ACTIVE.md",
    "active_blob_sha": "093a1e1a2567fa780f684a711185d085d85145bd",
    "review_path": "coordination/REVIEWS/W0-03C.md",
    "review_blob_sha": "4b87939057c1d573279b07879739691af9dc4da0",
    "handoff_comment_sha256": "357fe754714374138b7ab696aa24d334b82b952a1965b5cd6fcaae37e8a12443",
    "canonical_docs": [
      {
        "path": "CLAUDE.md",
        "blob_sha": "e91d3230b74be5807ecf1c86a4219a6a71ef7a92"
      },
      {
        "path": "docs/architecture/IMPLEMENTATION_GATE_MATRIX.md",
        "blob_sha": "3ad2670d66fa2a528a1c44984c13edd5f2d74bb1"
      },
      {
        "path": "docs/architecture/IMPLEMENTATION_WAVES.md",
        "blob_sha": "3e43105bf5c338ca54ad0cf3960f64e5a46b3bca"
      },
      {
        "path": "docs/architecture/W0-03C_UNIQUENESS_READINESS.md",
        "blob_sha": "f6896b40e4fd125a544f68f01c421f7b59ae3ce5"
      },
      {
        "path": "docs/flows/FLOW-032.md",
        "blob_sha": "94f6be34ed4cab2cd1eaef3ed3fc8baa762291f0"
      }
    ]
  },
  "updated_at": "2026-09-26T16:45:12Z",
  "history": [
    {
      "event_id": "pr20-comment-5764513929",
      "occurred_at": "2026-09-21T17:13:38Z",
      "task_id": "W0-03C",
      "cycle_id": null,
      "mapped_cycle": "C01",
      "actor": "UNKNOWN",
      "kind": "HANDOFF",
      "state_after": "HANDOFF",
      "head_sha": "25394418b118449db389066ec1c4ef0ae663ab20",
      "source_url": "https://github.com/krumingo/BEG_Worck/pull/20#issuecomment-5764513929",
      "source_commit_sha": null,
      "summary": "Initial Draft PR implementation HANDOFF; not an independent PASS."
    },
    {
      "event_id": "pr20-comment-5765042461",
      "occurred_at": "2026-09-21T17:54:07Z",
      "task_id": "W0-03C",
      "cycle_id": null,
      "mapped_cycle": "C01",
      "actor": "UNKNOWN",
      "kind": "HANDOFF",
      "state_after": "HANDOFF",
      "head_sha": "be8cd207c94388e81b24173af6d690d69abcea00",
      "source_url": "https://github.com/krumingo/BEG_Worck/pull/20#issuecomment-5765042461",
      "source_commit_sha": null,
      "summary": "Pre-protocol repair HANDOFF after an earlier blocked review claim."
    },
    {
      "event_id": "pr20-comment-5765269841",
      "occurred_at": "2026-09-21T18:11:51Z",
      "task_id": "W0-03C",
      "cycle_id": null,
      "mapped_cycle": "C01",
      "actor": "UNKNOWN",
      "kind": "EVIDENCE",
      "state_after": null,
      "head_sha": "be8cd207c94388e81b24173af6d690d69abcea00",
      "source_url": "https://github.com/krumingo/BEG_Worck/pull/20#issuecomment-5765269841",
      "source_commit_sha": null,
      "summary": "Real-Mongo test evidence for the earlier exact head; not proof for a later head."
    },
    {
      "event_id": "pr20-comment-5771473368",
      "occurred_at": "2026-09-22T05:04:44Z",
      "task_id": "W0-03C",
      "cycle_id": null,
      "mapped_cycle": "C01",
      "actor": "UNKNOWN",
      "kind": "EVIDENCE",
      "state_after": null,
      "head_sha": "be8cd207c94388e81b24173af6d690d69abcea00",
      "source_url": "https://github.com/krumingo/BEG_Worck/pull/20#issuecomment-5771473368",
      "source_commit_sha": null,
      "summary": "NAS restore-copy report evidence for the earlier exact head/data snapshot."
    },
    {
      "event_id": "review-ef006594",
      "occurred_at": "2026-09-22T05:46:10Z",
      "task_id": "W0-03C",
      "cycle_id": null,
      "mapped_cycle": "C01",
      "actor": "CODEX",
      "kind": "REVIEW",
      "state_after": "CHANGES_REQUESTED",
      "head_sha": "be8cd207c94388e81b24173af6d690d69abcea00",
      "source_url": "https://github.com/krumingo/BEG_Worck/commit/ef00659423e899265a0c39657ebd0c97c1011e73",
      "source_commit_sha": "ef00659423e899265a0c39657ebd0c97c1011e73",
      "summary": "Independent review requested three bounded corrections."
    },
    {
      "event_id": "queue-2a86eefb",
      "occurred_at": "2026-09-22T05:46:36Z",
      "task_id": "W0-03C",
      "cycle_id": null,
      "mapped_cycle": "C02",
      "actor": "CODEX",
      "kind": "ASSIGNMENT",
      "state_after": "CHANGES_REQUESTED",
      "head_sha": "be8cd207c94388e81b24173af6d690d69abcea00",
      "source_url": "https://github.com/krumingo/BEG_Worck/commit/2a86eefb1a38b200e0842d9b6b18f36e22f5905c",
      "source_commit_sha": "2a86eefb1a38b200e0842d9b6b18f36e22f5905c",
      "summary": "One-of-one correction assignment on the existing PR branch."
    },
    {
      "event_id": "queue-554109c4",
      "occurred_at": "2026-09-22T05:50:41Z",
      "task_id": "W0-03C",
      "cycle_id": null,
      "mapped_cycle": "C02",
      "actor": "CODEX",
      "kind": "DISPATCH",
      "state_after": null,
      "head_sha": "be8cd207c94388e81b24173af6d690d69abcea00",
      "source_url": "https://github.com/krumingo/BEG_Worck/commit/554109c4332b13a5da90310d9674419f9a5eb1eb",
      "source_commit_sha": "554109c4332b13a5da90310d9674419f9a5eb1eb",
      "summary": "Claude correction session recorded as RUNNING; not completion."
    },
    {
      "event_id": "pr20-comment-5771922130",
      "occurred_at": "2026-09-22T06:03:35Z",
      "task_id": "W0-03C",
      "cycle_id": null,
      "mapped_cycle": "C02",
      "actor": "CLAUDE",
      "kind": "HANDOFF",
      "state_after": "HANDOFF",
      "head_sha": "ed588e9420e241f58c14146de6f0c890b38b3743",
      "source_url": "https://github.com/krumingo/BEG_Worck/pull/20#issuecomment-5771922130",
      "source_commit_sha": null,
      "summary": "Correction HANDOFF for exact Draft PR head; awaiting independent review."
    },
    {
      "event_id": "review-3b991fae",
      "occurred_at": "2026-09-22T06:16:16Z",
      "task_id": "W0-03C",
      "cycle_id": null,
      "mapped_cycle": "C02",
      "actor": "CODEX",
      "kind": "REVIEW",
      "state_after": "BLOCKED",
      "head_sha": "ed588e9420e241f58c14146de6f0c890b38b3743",
      "source_url": "https://github.com/krumingo/BEG_Worck/commit/3b991fae892f7a22fdeb3e9d0f0920aa71841f19",
      "source_commit_sha": "3b991fae892f7a22fdeb3e9d0f0920aa71841f19",
      "summary": "Independent re-review found an untracked-index ambiguous-result defect; correction exhausted."
    },
    {
      "event_id": "queue-4ddea223",
      "occurred_at": "2026-09-22T06:17:02Z",
      "task_id": "W0-03C",
      "cycle_id": null,
      "mapped_cycle": "C02",
      "actor": "CODEX",
      "kind": "CONTROL_UPDATE",
      "state_after": "BLOCKED",
      "head_sha": "ed588e9420e241f58c14146de6f0c890b38b3743",
      "source_url": "https://github.com/krumingo/BEG_Worck/commit/4ddea223e7eccb29eb9f81e9c4eeca952b9bd5c1",
      "source_commit_sha": "4ddea223e7eccb29eb9f81e9c4eeca952b9bd5c1",
      "summary": "ACTIVE and Dispatch-State blocked; no next task or C03 authorized."
    },
    {
      "event_id": "pr20-comment-5847103313",
      "occurred_at": "2026-09-26T14:34:57Z",
      "task_id": "W0-03C",
      "cycle_id": "C03",
      "mapped_cycle": null,
      "actor": "KRUM",
      "kind": "EVIDENCE",
      "state_after": null,
      "head_sha": "ed588e9420e241f58c14146de6f0c890b38b3743",
      "source_url": "https://github.com/krumingo/BEG_Worck/pull/20#issuecomment-5847103313",
      "source_commit_sha": null,
      "summary": "Krum authorized one bounded C03 cycle for ambiguous create_index reconciliation; C02 BLOCKED remains historical."
    },
    {
      "event_id": "queue-fcfe5f0a",
      "occurred_at": "2026-09-26T14:42:37Z",
      "task_id": "W0-03C",
      "cycle_id": "C03",